,id,Statement,Image,Web,Category,Date,Label,clean,clean_joined
19456,19006,"In Assam, 10K ineligible names to be deleted from NRC",https://cmsimages.tribuneindia.com/gallary_content/2020/10/Desk/2020_10$smallthumbimg_1867850384.jpeg,TRIBUNEINDIA,GOVERNMENT,Oct-20,TRUE,"['assam', 'ineligible', 'names', 'deleted', 'nrc']",assam ineligible names deleted nrc
42761,39988,"No, this video does not show supporters of Indiaâs ruling party tearing down a statue of the countryâs first law minister",https://factcheck.afp.com/sites/default/files/styles/landing_tag_item_l/public/medias/factchecking/india/image_62.jpg?itok=A4jzX4gv,AFP,POLITICS,18-Dec,Fake,"['video', 'supporters', 'indiaâ', 'ruling', 'party', 'tearing', 'statue', 'countryâ', 'law', 'minister']",video supporters indiaâ ruling party tearing statue countryâ law minister
52918,36594,Reliance Defence rejects Rahulï¿½s allegations of Ambani interference in Rafale deal,https://static.theprint.in/wp-content/uploads/2019/02/Rahul-Gandhi-324x235.jpeg,THEPRINT,POLITICS,Feb-19,TRUE,"['reliance', 'defence', 'rejects', 'rahulï', 'allegations', 'ambani', 'interference', 'rafale', 'deal']",reliance defence rejects rahulï allegations ambani interference rafale deal
25817,43838,Woman held for trying to deposit fake currency notes in Kerala ,https://www.oneindia.com/img/250x90/2016/11/500-1000-10-1478750716.jpg,ONEINDIA,COVID-19,16-Nov,Fake,"['woman', 'held', 'trying', 'deposit', 'fake', 'currency', 'notes', 'kerala']",woman held trying deposit fake currency notes kerala
37157,727,"Himachal minister tests Covid-19 positive, 4 days ahead of monsoon session","https://images.indianexpress.com/2020/06/corona-testing-1200-1.jpg?resize=450,250",INDIANEXPRESS,COVID-19,Jun-20,TRUE,"['himachal', 'minister', 'tests', 'covid', 'positive', 'days', 'ahead', 'monsoon', 'session']",himachal minister tests covid positive days ahead monsoon session
32196,30974,"Its newly opened English medium schools in high demand, Chhattisgarh govt plans to scale up",https://static.theprint.in/wp-content/uploads/2021/01/Bhupesh-Baghel-324x235.jpg,THEPRINT,GOVERNMENT,Jan-21,TRUE,"['newly', 'opened', 'english', 'medium', 'schools', 'high', 'demand', 'chhattisgarh', 'govt', 'plans', 'scale']",newly opened english medium schools high demand chhattisgarh govt plans scale
25256,30369,"Two years back, RBI had rejected DBS Banks bid for 50% stake in Lakshmi Vilas Bank",https://static.theprint.in/wp-content/uploads/2020/11/lakshmivilas-324x235.jpg,THEPRINT,TERROR,Nov-20,TRUE,"['years', 'rbi', 'rejected', 'dbs', 'bank', 'bid', 'stake', 'lakshmi', 'vilas', 'bank']",years rbi rejected dbs bank bid stake lakshmi vilas bank
9429,46726,Old image from Egypt shared as male protester of Jamia Milia detained in a burqa, https://cmsimages.tribuneindia.com/gallary_content/2020/8/2020_8$smallthumbimg_509907404.jpg,AUGMENT,VIOLENCE,,Fake,"['old', 'image', 'egypt', 'shared', 'male', 'protester', 'jamia', 'milia', 'detained', 'burqa']",old image egypt shared male protester jamia milia detained burqa
36576,32747,AIMIM is BJPs middleman: TMC strongman Anubrata Mandal on Asaduddin Owaisis party,https://www.thestatesman.com/wp-content/uploads/2020/11/pjimage-87.jpg,THESTATEMAN,ELECTION,Nov-20,TRUE,"['aimim', 'bjp', 'middleman', 'tmc', 'strongman', 'anubrata', 'mandal', 'asaduddin', 'owaisi', 'party']",aimim bjp middleman tmc strongman anubrata mandal asaduddin owaisi party
9369,55736,Fact Check: Delhi Police Didn't Burn A Broken-Down Bus To Instigate Riots. Fact Check: Delhi Police Didn't Burn A Broken-Down Bus To Instigate...,https://englishtribuneimages.blob.core.windows.net/gallary-content/2020/11/2020_11$smallthumbimg_947774666.jpg,AUGMENT,MISLEADING,,Fake,"['fact', 'check', 'delhi', 'police', 'burn', 'broken', 'bus', 'instigate', 'riots', 'fact', 'check', 'delhi', 'police', 'burn', 'broken', 'bus', 'instigate']",fact check delhi police burn broken bus instigate riots fact check delhi police burn broken bus instigate
46922,51560,"Jatayu, mythical bird from Ramayana, spotted in Kerala? No, itÕs a condor from Argentina",https://newsmobile.in/wp-content/uploads/2020/06/Untitled-design-17-1.png,AUGMENT,VIOLENCE,,Fake,"['jatayu', 'mythical', 'bird', 'ramayana', 'spotted', 'kerala', 'itõs', 'condor', 'argentina']",jatayu mythical bird ramayana spotted kerala itõs condor argentina
34036,54422,Farmers' Protest: Govt to send proposal to farmers on APMC,https://englishtribuneimages.blob.core.windows.net/gallary-content/2021/1/2021_1$smallthumbimg_2117564124.jpg,AUGMENT,POLITICS,,Fake,"['farmers', 'protest', 'govt', 'send', 'proposal', 'farmers', 'apmc']",farmers protest govt send proposal farmers apmc
36751,38689,Fact Check: Owaisi never denied the existence of coronavirus,https://akm-img-a-in.tosshub.com/indiatoday/images/story/202007/thumbnail_cover_image__1_-170x96.jpeg?CKZ8oEnB_tADcuaRq6XRQy3O_KzmaIqo,INDIATODAY,GOVERNMENT,20-Jul,Fake,"['fact', 'check', 'owaisi', 'denied', 'existence', 'coronavirus']",fact check owaisi denied existence coronavirus
33828,19264,"Ganga museum to showcase riverÕs biodiversity, rejuvenation activities",https://cmsimages.tribuneindia.com/gallary_content/2020/9/2020_9$smallthumbimg_714723911.jpeg,TRIBUNEINDIA,GOVERNMENT,Sep-20,TRUE,"['ganga', 'museum', 'showcase', 'riverõs', 'biodiversity', 'rejuvenation', 'activities']",ganga museum showcase riverõs biodiversity rejuvenation activities
37396,13285,Eastern Ladakh stand-off: Himachal Governor urges Defence Minister to increase deployment,https://cmsimages.tribuneindia.com/gallary_content/2020/6/2020_6$smallthumbimg_1445975833.jpg,TRIBUNEINDIA,POLITICS,Jun-20,TRUE,"['eastern', 'ladakh', 'stand', 'himachal', 'governor', 'urges', 'defence', 'minister', 'increase', 'deployment']",eastern ladakh stand himachal governor urges defence minister increase deployment
50139,54104,"No Night On August 12, Say WhatsApp Forwards: Separating Space News...",https://englishtribuneimages.blob.core.windows.net/gallary-content/2020/12/2020_12$smallthumbimg_699510220.jpg,AUGMENT,MISLEADING,,Fake,"['night', 'august', 'whatsapp', 'forwards', 'separating', 'space', 'news']",night august whatsapp forwards separating space news
39263,24170,"PGIMER Chandigarh recruitment: Applications invited for various posts, apply till October 3 at pgimer.edu.in",https://www.thestatesman.com/wp-content/uploads/2019/09/vacancy.jpg,THESTATESMAN,GOVERNMENT,Sep-19,TRUE,"['pgimer', 'chandigarh', 'recruitment', 'applications', 'invited', 'posts', 'apply', 'till', 'october', 'pgimer']",pgimer chandigarh recruitment applications invited posts apply till october pgimer
162,22660,Narrow escape for Nagpur Mayor as 2 bike-borne man fire at him,https://www.thestatesman.com/wp-content/uploads/2019/12/joshi.jpg,THESTATESMAN,TERROR,Dec-19,TRUE,"['narrow', 'escape', 'nagpur', 'mayor', 'bike', 'borne', 'man']",narrow escape nagpur mayor bike borne man
25186,44010,"Fact Check: This rickshaw-puller was a lockdown saviour, wasnt jailed for anti-CAA protests",https://akm-img-a-in.tosshub.com/indiatoday/images/story/202007/EcQSPYfWsAAFwOI_0-170x96.jpeg?LM_U8908bSdhxmyozHtsPaB16rEWi7HQ,INDIATODAY,POLITICS,20-Jul,Fake,"['fact', 'check', 'rickshaw', 'puller', 'lockdown', 'saviour', 'jailed', 'anti', 'caa', 'protests']",fact check rickshaw puller lockdown saviour jailed anti caa protests
25613,29424,Shiv Sena wants quota for Muslims in Maharashtra ahead of Uddhav Thackerays Ayodhya visit,https://static.theprint.in/wp-content/uploads/2018/11/Uddhav-Thackeray-324x235.jpg,THEPRINT,ELECTION,Nov-18,TRUE,"['shiv', 'sena', 'wants', 'quota', 'muslims', 'maharashtra', 'ahead', 'uddhav', 'thackeray', 'ayodhya', 'visit']",shiv sena wants quota muslims maharashtra ahead uddhav thackeray ayodhya visit
37564,36557,BJP has a poll strategy for Priyanka Gandhi ï¿½ ignore her,https://static.theprint.in/wp-content/uploads/2019/02/Priyanka-Gandhi-Vadra-324x235.jpg,THEPRINT,POLITICS,Feb-19,TRUE,"['bjp', 'poll', 'strategy', 'priyanka', 'gandhi', 'ignore']",bjp poll strategy priyanka gandhi ignore
22908,37817,Viral Test: Who Photoshopped Ex-Prez Mukherjee In RSS Cap?,https://akm-img-a-in.tosshub.com/indiatoday/images/story/201806/5365365-170x96.png?rxogkZ3lH2OdZX472bRiqY1s7tQoE6fu,INDIATODAY,GOVERNMENT,18-Jun,Fake,"['viral', 'test', 'photoshopped', 'prez', 'mukherjee', 'rss', 'cap']",viral test photoshopped prez mukherjee rss cap
42512,34596,"Punjab govt moves resolution against CAA in Assembly, second state to do so after Kerala",https://www.thestatesman.com/wp-content/uploads/2020/01/Punjab.jpg,THESTATEMAN,ELECTION,Jan-20,TRUE,"['punjab', 'govt', 'moves', 'resolution', 'caa', 'assembly', 'second', 'state', 'kerala']",punjab govt moves resolution caa assembly second state kerala
49345,21603,"Bengal govt might opt out of CentreÕs Ôone nation, one ration cardÕ scheme",https://www.thestatesman.com/wp-content/uploads/2019/10/QT-ration-cards.jpg,THESTATESMAN,GOVERNMENT,Oct-19,TRUE,"['bengal', 'govt', 'opt', 'centreõs', 'ôone', 'nation', 'ration', 'cardõ', 'scheme']",bengal govt opt centreõs ôone nation ration cardõ scheme
35509,27886,"Unlike BJP, which has just one voice, Congress gives every voice importance: Priyanka Gandhi",https://static.theprint.in/wp-content/uploads/2019/08/Priyanka-Gandhi-in-Sonbhadra-324x235.jpg,THEPRINT,ELECTION,Aug-19,TRUE,"['unlike', 'bjp', 'voice', 'congress', 'gives', 'voice', 'importance', 'priyanka', 'gandhi']",unlike bjp voice congress gives voice importance priyanka gandhi
30907,38189,Fact Check: Congress womenâs wing targets âGujarat Modelâ over dowry lesson but with the wrong photo,https://akm-img-a-in.tosshub.com/indiatoday/images/story/201907/wedding---facebook-and-storysi-170x96.jpeg?ClB8KwmK4ZUBbKTfX0SmVA10Nkdxpfd7,INDIATODAY,POLITICS,19-Jul,Fake,"['fact', 'check', 'congress', 'womenâ', 'wing', 'targets', 'gujarat', 'modelâ', 'dowry', 'lesson', 'wrong', 'photo']",fact check congress womenâ wing targets gujarat modelâ dowry lesson wrong photo
20588,44790,"Dont believe the FAKE news of Priyanka, Nick getting a divorce",https://newsmobile.in/wp-content/uploads/2019/04/PEECEE.jpg,NEWSMOBILE,VIOLENCE,19-Apr,Fake,"['believe', 'fake', 'news', 'priyanka', 'nick', 'getting', 'divorce']",believe fake news priyanka nick getting divorce
4765,11019,India-assisted venture to dwarf Chinese bridge in Maldives as most visible project,https://cmsimages.tribuneindia.com/gallary_content/2020/8/2020_8$smallthumbimg_465189446.jpg,TRIBUNEINDIA,POLITICS,Aug-20,TRUE,"['india', 'assisted', 'venture', 'dwarf', 'chinese', 'bridge', 'maldives', 'visible', 'project']",india assisted venture dwarf chinese bridge maldives visible project
19118,40476,Fact check: Bengaluru jewellerâs Nizam claims stand exposed,https://newsmeter.in/wp-content/uploads/2020/02/WhatsApp-Image-2020-02-10-at-1.09.51-PM-300x220.jpeg,NEWSMETER,MISLEADING,20-Feb,Fake,"['fact', 'check', 'bengaluru', 'jewellerâ', 'nizam', 'claims', 'stand', 'exposed']",fact check bengaluru jewellerâ nizam claims stand exposed
23616,52880,"Fact Check: Old Video Shared With False Claim Of It Showing Crowd At Borivali Station, Mumbai On.... This fabricated video has been designed by adding pictures and videos of old incidents held in different cities. It is being spread with the claim that the videos represent the current situation o...",https://www.thestatesman.com/wp-content/uploads/2020/04/keke.jpg,AUGMENT,VIOLENCE,,Fake,"['fact', 'check', 'old', 'video', 'shared', 'false', 'claim', 'showing', 'crowd', 'borivali', 'station', 'mumbai', 'fabricated', 'video', 'designed', 'adding', 'pictures', 'videos', 'old', 'incidents', 'held', 'different', 'cities', 'spread', 'claim', 'videos', 'represent', 'current', 'situation']",fact check old video shared false claim showing crowd borivali station mumbai fabricated video designed adding pictures videos old incidents held different cities spread claim videos represent current situation
2962,10742,"SCÛªs PM-CARES decision: BJP hails verdict, attacks Rahul; Cong calls it Û÷body blow to transparencyÛª",https://cmsimages.tribuneindia.com/gallary_content/2020/8/2020_8$smallthumbimg_1440439870.jpg,TRIBUNEINDIA,ELECTION,Aug-20,TRUE,"['ûªs', 'cares', 'decision', 'bjp', 'hails', 'verdict', 'attacks', 'rahul', 'cong', 'calls', 'body', 'blow', 'transparency']",ûªs cares decision bjp hails verdict attacks rahul cong calls body blow transparency
11173,43810,Two booked for running fake website using Narendra Modi's name ,https://www.oneindia.com/img/250x90/2017/01/modi-27-1485537443.jpg,ONEINDIA,GOVERNMENT,17-Jan,Fake,"['booked', 'running', 'fake', 'website', 'narendra', 'modi']",booked running fake website narendra modi
56647,43187,Swara Bhaskar didnt tweet this on Maulana slapping woman on live...,https://newsmobile.in/wp-content/uploads/2018/07/7be94209-f8ec-44a0-ab41-51f990fc4cdc.jpg,NEWSMOBILE,POLITICS,18-Jul,Fake,"['swara', 'bhaskar', 'tweet', 'maulana', 'slapping', 'woman', 'live']",swara bhaskar tweet maulana slapping woman live
11171,32618,Indian Army signs MoU with Bank of Baroda for new Baroda Military Salary Package,https://www.thestatesman.com/wp-content/uploads/2019/08/QT-jk.jpg,THESTATEMAN,COVID-19,Aug-19,TRUE,"['indian', 'army', 'signs', 'mou', 'bank', 'baroda', 'new', 'baroda', 'military', 'salary', 'package']",indian army signs mou bank baroda new baroda military salary package
9837,52833,How SonyLIV's PR Stunt Created Panic And Fake News. Congress IT Cell Chief Revives Misleading Old Video On Modi's,https://www.thestatesman.com/wp-content/uploads/2020/03/QT-yoga-nidra.jpg,AUGMENT,VIOLENCE,,Fake,"['sonyliv', 'stunt', 'created', 'panic', 'fake', 'news', 'congress', 'cell', 'chief', 'revives', 'misleading', 'old', 'video', 'modi']",sonyliv stunt created panic fake news congress cell chief revives misleading old video modi
15721,44702,Is Bhim Army chiefs real name Naseemuddin Khan? Heres the fact...,https://newsmobile.in/wp-content/uploads/2019/06/64239064_361883137800377_6824730323566198784_n-1.jpg,NEWSMOBILE,ELECTION,19-Jun,Fake,"['bhim', 'army', 'chief', 'real', 'naseemuddin', 'khan', 'fact']",bhim army chief real naseemuddin khan fact
8392,36044,"Sportspersons, 11 turncoats in BJPï¿½s first list of 78 candidates for Haryana elections",https://static.theprint.in/wp-content/uploads/2019/09/Babita-Phogat-324x235.jpeg,THEPRINT,ELECTION,Sep-19,TRUE,"['sportspersons', 'turncoats', 'bjpï', 'list', 'candidates', 'haryana', 'elections']",sportspersons turncoats bjpï list candidates haryana elections
37772,17408,First batch of Sputnik V vaccine to arrive in Kanpur medical college,https://cmsimages.tribuneindia.com/gallary_content/2020/11/2020_11$smallthumbimg_1421941637.jpg,TRIBUNEINDIA,COVID-19,Nov-20,TRUE,"['batch', 'sputnik', 'vaccine', 'arrive', 'kanpur', 'medical', 'college']",batch sputnik vaccine arrive kanpur medical college
14162,11612,ICMR plans to set up registry of hospitalised COVID-19 patients,https://cmsimages.tribuneindia.com/gallary_content/2020/8/2020_8$smallthumbimg_410877602.JPG,TRIBUNEINDIA,COVID-19,Aug-20,TRUE,"['icmr', 'plans', 'set', 'registry', 'hospitalised', 'covid', 'patients']",icmr plans set registry hospitalised covid patients
8921,47389,Photoshopped tweet of Bill Gates supporting animal sacrifice on Eid shared on social media, https://cmsimages.tribuneindia.com/gallary_content/2020/8/2020_8$smallthumbimg_782564980.jpg,AUGMENT,GOVERNMENT,,Fake,"['photoshopped', 'tweet', 'gates', 'supporting', 'animal', 'sacrifice', 'eid', 'shared', 'social', 'media']",photoshopped tweet gates supporting animal sacrifice eid shared social media
4358,24913,Man wins $1 million lottery with the numbers his family has played for 50 years,https://cdn.cnn.com/cnnnext/dam/assets/200821143914-australia-lottery-win-trnd-super-tease.jpg,CNN,POLITICS,Aug-20,TRUE,"['man', 'wins', 'million', 'lottery', 'numbers', 'family', 'played', 'years']",man wins million lottery numbers family played years
56321,51438,ÔWho do you like the most?Õ Guess what these Modi fans believe the child told Trump,https://newsmobile.in/wp-content/uploads/2019/03/COW_FAKE.jpg,AUGMENT,GOVERNMENT,,Fake,"['ôwho', 'like', 'guess', 'modi', 'fans', 'believe', 'child', 'told', 'trump']",ôwho like guess modi fans believe child told trump
33139,33864,Kerala HC stays govt order to supply liquor to those with withdrawal syndrome amid lockdown,https://www.thestatesman.com/wp-content/uploads/2020/04/liquor.jpg,THESTATEMAN,GOVERNMENT,Apr-20,TRUE,"['kerala', 'stays', 'govt', 'order', 'supply', 'liquor', 'withdrawal', 'syndrome', 'amid', 'lockdown']",kerala stays govt order supply liquor withdrawal syndrome amid lockdown
19694,24757,RRB JE final answer keys 2019 released for first stage CBT at rrbcdg.gov.in | Check now,https://www.thestatesman.com/wp-content/uploads/2019/07/iStock-1136591568-1.jpg,THESTATESMAN,TERROR,Jul-19,TRUE,"['rrb', 'final', 'answer', 'keys', 'released', 'stage', 'cbt', 'rrbcdg', 'gov', 'check']",rrb final answer keys released stage cbt rrbcdg gov check
28699,43248,"Fact Check: No, PM Modi Has Not Announced Lockdown In Five States As Claimed By A Viral Video",https://thelogicalindian.com/h-upload/2020/11/27/500x300_186193-locweb.jpg,THELOGICALINDIAN,COVID-19,20-Nov,Fake,"['fact', 'check', 'modi', 'announced', 'lockdown', 'states', 'claimed', 'viral', 'video']",fact check modi announced lockdown states claimed viral video
27516,48926,Who Is Sambhaji Bhide & Why PM Narendra Modi Admires Him, https://www.thestatesman.com/wp-content/uploads/2020/11/QT-Rahul-Gandhi.jpg,AUGMENT,GOVERNMENT,,Fake,"['sambhaji', 'bhide', 'narendra', 'modi', 'admires']",sambhaji bhide narendra modi admires
34447,5646,"Army draft policy for rehab of local militants pending with govt, says senior Army officer","https://images.indianexpress.com/2020/10/army-2.jpg?resize=450,250",INDIANEXPRESS,TERROR,Oct-20,TRUE,"['army', 'draft', 'policy', 'rehab', 'local', 'militants', 'pending', 'govt', 'says', 'senior', 'army', 'officer']",army draft policy rehab local militants pending govt says senior army officer
50885,1052,"IndiaÛªs Covid tally crosses 66.85 lakh, death toll surpasses 1.03 lakh",https://www.thestatesman.com/wp-content/uploads/2020/09/corona-1.jpg,THESTATESMAN,COVID-19,Sep-20,TRUE,"['india', 'ûªs', 'covid', 'tally', 'crosses', 'lakh', 'death', 'toll', 'surpasses', 'lakh']",india ûªs covid tally crosses lakh death toll surpasses lakh
48243,2948,"With spike of 70,496 cases, India's COVID-19 tally crosses 69-lakh mark","https://imgk.timesnownews.com/story/Ahmedabad-covid-19-repr-AP.jpg?tr=w-100,h-75",TIMESNOW,COVID-19,Oct-20,TRUE,"['spike', 'cases', 'india', 'covid', 'tally', 'crosses', 'lakh', 'mark']",spike cases india covid tally crosses lakh mark
27127,47268,The NOTA story of 2018 Karnataka elections, https://www.thestatesman.com/wp-content/uploads/2020/06/rs.jpg,AUGMENT,POLITICS,,Fake,"['nota', 'story', 'karnataka', 'elections']",nota story karnataka elections
14380,33519,"Andhra Pradesh: YSRCP govt sets up Special Enforcement Bureau to crack down on illegal sale of liquor, sand",https://www.thestatesman.com/wp-content/uploads/2020/05/ysr.jpg,THESTATEMAN,GOVERNMENT,May-20,TRUE,"['andhra', 'pradesh', 'ysrcp', 'govt', 'sets', 'special', 'enforcement', 'bureau', 'crack', 'illegal', 'sale', 'liquor', 'sand']",andhra pradesh ysrcp govt sets special enforcement bureau crack illegal sale liquor sand
42955,50967,UP govt approved estimated budget of Rs 1.33 cr NOT Rs 133 cr for âDeepotsavâ; media misreports,https://static.theprint.in/wp-content/uploads/2019/03/D2p_xBOUcAARTYf-e1570877260673-324x235.jpg,AUGMENT,COVID-19,,Fake,"['govt', 'approved', 'estimated', 'budget', 'deepotsavâ', 'media', 'misreports']",govt approved estimated budget deepotsavâ media misreports
23071,5274,RBI Governor Shaktikanta Das tests positive for COVID-19,"https://images.indianexpress.com/2020/10/shaktikanta-das-2.jpg?resize=450,250",INDIANEXPRESS,COVID-19,Oct-20,TRUE,"['rbi', 'governor', 'shaktikanta', 'das', 'tests', 'positive', 'covid']",rbi governor shaktikanta das tests positive covid
45241,5003,"After ScindiaÕs slip of tongue, Congress assures him of party win in MP bypolls","https://images.indianexpress.com/2020/06/scindia-1200-2.jpg?resize=450,250",INDIANEXPRESS,ELECTION,Jun-20,TRUE,"['scindiaõs', 'slip', 'tongue', 'congress', 'assures', 'party', 'win', 'bypolls']",scindiaõs slip tongue congress assures party win bypolls
16633,53119,Fact Check: Has NEET(UG)-2020 been postponed to August? Here?s the truth. Will Iockdown be for three months? Here is the fact check,https://newsmobile.in/wp-content/uploads/2020/03/e25ec3f9-fadf-486a-80ab-e24db6d4b658.jpg,AUGMENT,MISLEADING,,Fake,"['fact', 'check', 'neet', 'postponed', 'august', 'truth', 'iockdown', 'months', 'fact', 'check']",fact check neet postponed august truth iockdown months fact check
4760,23739,BJP sends notice to Rudrapur MLA for making derogatory remarks against Muslims,https://www.thestatesman.com/wp-content/uploads/2019/10/16195389_1804365163160242_3271946665436543580_n.jpg,THESTATESMAN,ELECTION,Oct-19,TRUE,"['bjp', 'sends', 'notice', 'rudrapur', 'mla', 'making', 'derogatory', 'remarks', 'muslims']",bjp sends notice rudrapur mla making derogatory remarks muslims
31870,46175,"Shashi Tharoor tweets photo of Jawaharlal Nehru, Indira Gandhi in Soviet...", https://static.theprint.in/wp-content/uploads/2019/05/20190530204L-324x235.jpg,AUGMENT,GOVERNMENT,,Fake,"['shashi', 'tharoor', 'tweets', 'photo', 'jawaharlal', 'nehru', 'indira', 'gandhi', 'soviet']",shashi tharoor tweets photo jawaharlal nehru indira gandhi soviet
7533,36516,"Priyanka Vadra wonï¿½t make a difference, SP-BSP alliance a false alarm, says UP CM Adityanath",https://static.theprint.in/wp-content/uploads/2018/11/adityanath-324x235.jpg,THEPRINT,GOVERNMENT,Nov-18,TRUE,"['priyanka', 'vadra', 'wonï', 'difference', 'bsp', 'alliance', 'false', 'alarm', 'says', 'adityanath']",priyanka vadra wonï difference bsp alliance false alarm says adityanath
6009,30228,Why high shipping rates are a new headwind for global economy,https://static.theprint.in/wp-content/uploads/2020/06/Untitled-design-2020-06-25T201304.270-324x235.jpg,THEPRINT,POLITICS,Jun-20,TRUE,"['high', 'shipping', 'rates', 'new', 'headwind', 'global', 'economy']",high shipping rates new headwind global economy
52083,23924,Organisation of Islamic Cooperation asks India to ÔrescindÕ its actions in Kashmir,https://www.thestatesman.com/wp-content/uploads/2019/09/000_1JN1ZY.jpg,THESTATESMAN,TERROR,Sep-19,TRUE,"['organisation', 'islamic', 'cooperation', 'asks', 'india', 'ôrescindõ', 'actions', 'kashmir']",organisation islamic cooperation asks india ôrescindõ actions kashmir
52474,30819,"Pained by loss of lives, says PM Modi on Shivamogga explosion incident",https://static.theprint.in/wp-content/uploads/2020/09/modi2-324x235.png,THEPRINT,POLITICS,Sep-20,TRUE,"['pained', 'loss', 'lives', 'says', 'modi', 'shivamogga', 'explosion', 'incident']",pained loss lives says modi shivamogga explosion incident
34642,45414,Fake Twitter Account Masquerading As A Foreigner Behind Viral Durga..., https://newsmobile.in/wp-content/uploads/2020/06/Coronavirus_FAKE.jpg,AUGMENT,GOVERNMENT,,Fake,"['fake', 'twitter', 'account', 'masquerading', 'foreigner', 'viral', 'durga']",fake twitter account masquerading foreigner viral durga
51498,29182,"James Bond, defence deal and the govt  Not a spy movie but Rafale debate in Lok Sabha",https://static.theprint.in/wp-content/uploads/2019/01/arun-jaitley-324x235.jpg,THEPRINT,ELECTION,Jan-19,TRUE,"['james', 'bond', 'defence', 'deal', 'govt', 'spy', 'movie', 'rafale', 'debate', 'lok', 'sabha']",james bond defence deal govt spy movie rafale debate lok sabha
54720,9947,"Students, staff from containment zones not allowed at exam centres: Health Ministry SOPs",https://cmsimages.tribuneindia.com/gallary_content/2020/9/2020_9$smallthumbimg_582087047.JPG,TRIBUNEINDIA,GOVERNMENT,Sep-20,TRUE,"['students', 'staff', 'containment', 'zones', 'allowed', 'exam', 'centres', 'health', 'ministry', 'sops']",students staff containment zones allowed exam centres health ministry sops
31216,13570,DGCA amends quarantine rules for airline crew,https://cmsimages.tribuneindia.com/gallary_content/2020/6/2020_6$smallthumbimg_1900970730.jpg,TRIBUNEINDIA,POLITICS,Jun-20,TRUE,"['dgca', 'amends', 'quarantine', 'rules', 'airline', 'crew']",dgca amends quarantine rules airline crew
1917,46409,"Swapan DasguptaÕs U-turn, ÔDesiÕ Aadhar that couldnÕt be trusted prior to 2014 has become trustworthy in 2017", https://static.theprint.in/wp-content/uploads/2019/06/BJPviolence-e1560352349785-324x235.jpg,AUGMENT,MISLEADING,,Fake,"['swapan', 'dasguptaõs', 'turn', 'ôdesiõ', 'aadhar', 'couldnõt', 'trusted', 'prior', 'trustworthy']",swapan dasguptaõs turn ôdesiõ aadhar couldnõt trusted prior trustworthy
51112,22174,BJP repeatedly ÔharassingÕ Congress leader Hardik Patel: Priyanka Gandhi Vadra,https://www.thestatesman.com/wp-content/uploads/2020/01/priyanka-gandhi-1.jpg,THESTATESMAN,ELECTION,Jan-20,TRUE,"['bjp', 'repeatedly', 'ôharassingõ', 'congress', 'leader', 'hardik', 'patel', 'priyanka', 'gandhi', 'vadra']",bjp repeatedly ôharassingõ congress leader hardik patel priyanka gandhi vadra
34574,47788,"BJP?s Yogeshwar Dutt loses to Congress again in Haryana?s Baroda, in 1st poll after farm laws", https://static.theprint.in/wp-content/uploads/2020/11/YogeshwarDutt-324x235.jpg,AUGMENT,GOVERNMENT,,Fake,"['bjp', 'yogeshwar', 'dutt', 'loses', 'congress', 'haryana', 'baroda', 'poll', 'farm', 'laws']",bjp yogeshwar dutt loses congress haryana baroda poll farm laws
3041,20496,"41 teams are pre-positioned for Orissa, West Bengal which are likely to be hit by AMPHAN: NDRF",https://www.thestatesman.com/wp-content/uploads/2020/05/cyclone-1.jpg,THESTATESMAN,VIOLENCE,May-20,TRUE,"['teams', 'pre', 'positioned', 'orissa', 'west', 'bengal', 'likely', 'hit', 'amphan', 'ndrf']",teams pre positioned orissa west bengal likely hit amphan ndrf
