,id,Statement,Image,Web,Category,Date,Label,clean,clean_joined
645,23766,"Õ10 enemies will be killed for every soldierÕs death,Õ warns Amit Shah",https://www.thestatesman.com/wp-content/uploads/2019/10/amit-shah-1.jpg,THESTATESMAN,COVID-19,Oct-19,TRUE,"['enemies', 'killed', 'soldierõs', 'death', 'warns', 'amit', 'shah']",enemies killed soldierõs death warns amit shah
25966,338,"Haryana: To oppose farm laws, INLD to protest in 14 districts on October 6","https://images.indianexpress.com/2019/10/abhay-chautala-1200.jpg?resize=450,250",INDIANEXPRESS,GOVERNMENT,Oct-19,TRUE,"['haryana', 'oppose', 'farm', 'laws', 'inld', 'protest', 'districts', 'october']",haryana oppose farm laws inld protest districts october
14719,45633,"Second manufactured audio clip, this one claims BJP plotted to hack EVMs", https://cmsimages.tribuneindia.com/gallary_content/2020/11/2020_11$smallthumbimg_487204972.jpg,AUGMENT,MISLEADING,,Fake,"['second', 'manufactured', 'audio', 'clip', 'claims', 'bjp', 'plotted', 'hack', 'evms']",second manufactured audio clip claims bjp plotted hack evms
24034,34273,"Tribals demand separate status in census, hold protest at Jantar Mantar",https://www.thestatesman.com/wp-content/uploads/2020/02/PROTESTS-2335.jpg,THESTATEMAN,GOVERNMENT,Feb-20,TRUE,"['tribals', 'demand', 'separate', 'status', 'census', 'hold', 'protest', 'jantar', 'mantar']",tribals demand separate status census hold protest jantar mantar
1619,49496,"Claims Say Kathua Gang-Rape Accused Was Taking Exam, CCTV Footage Proves Otherwise.No, this video does not show the severed head of a man accused of rape in India", https://newsmobile.in/wp-content/uploads/2020/07/Delhi_Flood_FAKE.jpg,AUGMENT,VIOLENCE,,Fake,"['claims', 'kathua', 'gang', 'rape', 'accused', 'taking', 'exam', 'cctv', 'footage', 'proves', 'video', 'severed', 'head', 'man', 'accused', 'rape', 'india']",claims kathua gang rape accused taking exam cctv footage proves video severed head man accused rape india
26553,36400,"Deve Gowdaï¿½s grandsons hope to make it to Lok Sabha on dynasty, bravado & not much else",https://static.theprint.in/wp-content/uploads/2019/04/JDS-e1555325396549-324x235.jpg,THEPRINT,ELECTION,Apr-19,TRUE,"['deve', 'gowdaï', 'grandsons', 'hope', 'lok', 'sabha', 'dynasty', 'bravado']",deve gowdaï grandsons hope lok sabha dynasty bravado
9275,36271,"Exit polls predict surge for Modiï¿½s NDA, yet another drubbing for Congress",https://static.theprint.in/wp-content/uploads/2018/08/2018_8img23_Aug_2018_PTI8_23_2018_000255B-324x235.jpg,THEPRINT,TRAD,Aug-18,TRUE,"['exit', 'polls', 'predict', 'surge', 'modiï', 'nda', 'drubbing', 'congress']",exit polls predict surge modiï nda drubbing congress
12067,13771,"Business activity approaching pre-Covid level, says PM",https://cmsimages.tribuneindia.com/gallary_content/2020/6/2020_6$smallthumbimg_46207257.jpg,TRIBUNEINDIA,POLITICS,Jun-20,TRUE,"['business', 'activity', 'approaching', 'pre', 'covid', 'level', 'says']",business activity approaching pre covid level says
18753,14803,Govt must immediately open its coffers and help the needy: Sonia,https://cmsimages.tribuneindia.com/gallary_content/2020/5/2020_5$smallthumbimg_1544529455.jpg,TRIBUNEINDIA,GOVERNMENT,May-20,TRUE,"['govt', 'immediately', 'open', 'coffers', 'help', 'needy', 'sonia']",govt immediately open coffers help needy sonia
18845,13401,Second batch of 250 Indians stranded in Pakistan due to lockdown return home,https://cmsimages.tribuneindia.com/gallary_content/2020/6/2020_6$smallthumbimg_1560959216.jpg,TRIBUNEINDIA,COVID-19,Jun-20,TRUE,"['second', 'batch', 'indians', 'stranded', 'pakistan', 'lockdown', 'return', 'home']",second batch indians stranded pakistan lockdown return home
41832,10567,Nine killed in fire at Telangana power plant,https://cmsimages.tribuneindia.com/gallary_content/2020/8/2020_8$smallthumbimg_1735949724.jpg,TRIBUNEINDIA,POLITICS,Aug-20,TRUE,"['killed', 'telangana', 'power', 'plant']",killed telangana power plant
32441,38019,Fact Check: No political party was involved in this hair pulling incident,https://akm-img-a-in.tosshub.com/indiatoday/images/story/201903/fact-check-girl-770-170x96.jpeg?eFColqnx7rZ52r02G5IVu45JNZbPp77G,INDIATODAY,POLITICS,19-Mar,Fake,"['fact', 'check', 'political', 'party', 'involved', 'hair', 'pulling', 'incident']",fact check political party involved hair pulling incident
12984,37444,J&Kï¿½s all-round development Centreï¿½s major goal  ï¿½ Parliamentary panel on visit to UT,https://static.theprint.in/wp-content/uploads/2021/01/JK-parlimanetary_edited-324x235.jpg,THEPRINT,ELECTION,Jan-21,TRUE,"['round', 'development', 'centreï', 'major', 'goal', 'parliamentary', 'panel', 'visit']",round development centreï major goal parliamentary panel visit
34217,49620,"Fact Check: Fake tweet on France deporting Pakistanis go viral after Imran slams Macron.HoaXposed: AAPs Alka Lamba tweets fake photo of pre-poll survey, deletes", https://akm-img-a-in.tosshub.com/indiatoday/images/story/202011/cover_pic-170x96.png?8xdlwwMX8K2.Ig6Ec2YuMAjD6_swVVai,AUGMENT,GOVERNMENT,,Fake,"['fact', 'check', 'fake', 'tweet', 'france', 'deporting', 'pakistanis', 'viral', 'imran', 'slams', 'macron', 'hoaxposed', 'aap', 'alka', 'lamba', 'tweets', 'fake', 'photo', 'pre', 'poll', 'survey', 'deletes']",fact check fake tweet france deporting pakistanis viral imran slams macron hoaxposed aap alka lamba tweets fake photo pre poll survey deletes
19488,49971,Narendra Modi cancels his Japan visit. Manmohan To Sue Narendra Modi For Snatching Maun Tag From Him, https://teekhimirchi.in/wp-content/uploads/2014/06/Narendra_Modi_on_Akhand_Bharat_Mission_featured-326x245.png,AUGMENT,GOVERNMENT,,Fake,"['narendra', 'modi', 'cancels', 'japan', 'visit', 'manmohan', 'sue', 'narendra', 'modi', 'snatching', 'maun', 'tag']",narendra modi cancels japan visit manmohan sue narendra modi snatching maun tag
25032,4042,Venkaiah Naidu: Judicial over-reach in some verdictsÉ organs of state must respect their limits,"https://images.indianexpress.com/2020/11/Venkaiah-Naidu.jpg?resize=450,250",INDIANEXPRESS,TERROR,Nov-20,TRUE,"['venkaiah', 'naidu', 'judicial', 'reach', 'verdictsé', 'organs', 'state', 'respect', 'limits']",venkaiah naidu judicial reach verdictsé organs state respect limits
47801,42501,Fact Check: Did Rahul Gandhi get migrant workers strategically placed for...,https://newsmobile.in/wp-content/uploads/2020/05/2e006f70-9a2f-4b63-a10b-534bc96f660f.jpg,NEWSMOBILE,MISLEADING,20-May,Fake,"['fact', 'check', 'rahul', 'gandhi', 'migrant', 'workers', 'strategically', 'placed']",fact check rahul gandhi migrant workers strategically placed
53989,28795,"Rajnath reveals Modi govt carried out another cross-border strike apart from 2016, 2019",https://static.theprint.in/wp-content/uploads/2019/02/singh-324x235.jpg,THEPRINT,COVID-19,Feb-19,TRUE,"['rajnath', 'reveals', 'modi', 'govt', 'carried', 'cross', 'border', 'strike', 'apart']",rajnath reveals modi govt carried cross border strike apart
1685,16769,"Set up four Courts of Appeal, make SC constitutional court: AG",https://cmsimages.tribuneindia.com/gallary_content/2020/11/2020_11$smallthumbimg_102645415.JPG,TRIBUNEINDIA,TERROR,Nov-20,TRUE,"['set', 'courts', 'appeal', 'constitutional', 'court']",set courts appeal constitutional court
26092,36807,PM Modi says Dalit leader Sitaram Kesri wasnï¿½t allowed to complete term as Congress chief,https://static.theprint.in/wp-content/uploads/2018/11/2018_11img16_Nov_2018_PTI11_16_2018_000086B-e1547622495987-324x235.jpg,THEPRINT,GOVERNMENT,Nov-18,TRUE,"['modi', 'says', 'dalit', 'leader', 'sitaram', 'kesri', 'wasnï', 'allowed', 'complete', 'term', 'congress', 'chief']",modi says dalit leader sitaram kesri wasnï allowed complete term congress chief
32924,44609,Dont believe this picture of PM Modi in Keffiyeh; heres the...,https://newsmobile.in/wp-content/uploads/2019/10/PM_Modi_Kaf_FAKE-324x160.jpg,NEWSMOBILE,VIOLENCE,19-Oct,Fake,"['believe', 'picture', 'modi', 'keffiyeh']",believe picture modi keffiyeh
26026,25221,"Costa Rica reopens to US tourists, but only from six states",https://cdn.cnn.com/cnnnext/dam/assets/200820215017-costa-rica-tourism-0803-super-tease.jpg,CNN,VIOLENCE,Aug-20,TRUE,"['costa', 'rica', 'reopens', 'tourists', 'states']",costa rica reopens tourists states
4133,4737,PM Modi: Shipping ministry to be renamed,"https://images.indianexpress.com/2020/11/PTI07-11-2020_000044B.jpg?resize=450,250",INDIANEXPRESS,POLITICS,Nov-20,TRUE,"['modi', 'shipping', 'ministry', 'renamed']",modi shipping ministry renamed
1184,42183,Fact Check: This video of tornado is NOT of Cyclone Nivar...,https://newsmobile.in/wp-content/uploads/2020/11/WhatsApp-Image-2020-11-28-at-12.55.38-PM.jpeg,NEWSMOBILE,VIOLENCE,20-Nov,Fake,"['fact', 'check', 'video', 'tornado', 'cyclone', 'nivar']",fact check video tornado cyclone nivar
17159,16557,"NCB seeks cancellation of Bharti Singh, husband Haarsh's bail in drugs case",https://cmsimages.tribuneindia.com/gallary_content/2020/12/2020_12$smallthumbimg_687055923.JPG,TRIBUNEINDIA,VIOLENCE,Dec-20,TRUE,"['ncb', 'seeks', 'cancellation', 'bharti', 'singh', 'husband', 'haarsh', 'bail', 'drugs', 'case']",ncb seeks cancellation bharti singh husband haarsh bail drugs case
5710,18981,"Nitish insulted my father, worked against LJP candidates in 2019 LS polls: Chirag",https://cmsimages.tribuneindia.com/gallary_content/2020/10/2020_10$smallthumbimg_1816006143.jpeg,TRIBUNEINDIA,ELECTION,Oct-20,TRUE,"['nitish', 'insulted', 'father', 'worked', 'ljp', 'candidates', 'polls', 'chirag']",nitish insulted father worked ljp candidates polls chirag
9104,32666,Sub-machine gun designed by DRDO successfully completes Defence Ministrys user trials,https://www.thestatesman.com/wp-content/uploads/2020/12/drdo.jpg,THESTATEMAN,COVID-19,Dec-20,TRUE,"['sub', 'machine', 'gun', 'designed', 'drdo', 'successfully', 'completes', 'defence', 'ministry', 'user', 'trials']",sub machine gun designed drdo successfully completes defence ministry user trials
6116,18236,Foreign Secretary to visit ÔoldÕ Europe,https://cmsimages.tribuneindia.com/gallary_content/2020/10/2020_10$smallthumbimg_1184825601.jpg,TRIBUNEINDIA,POLITICS,Oct-20,TRUE,"['foreign', 'secretary', 'visit', 'ôoldõ', 'europe']",foreign secretary visit ôoldõ europe
19909,54771,Fact Check: Did Wayanad celebrate Rahul Gandhi?s victory with Pakistani flags?.Fact Check: Did Wayanad cheer up for Rahul Gandhi waving Pakistan flags?,https://englishtribuneimages.blob.core.windows.net/gallary-content/2021/1/2021_1$smallthumbimg_1203611389.jpg,AUGMENT,MISLEADING,,Fake,"['fact', 'check', 'wayanad', 'celebrate', 'rahul', 'gandhi', 'victory', 'pakistani', 'flags', 'fact', 'check', 'wayanad', 'cheer', 'rahul', 'gandhi', 'waving', 'pakistan', 'flags']",fact check wayanad celebrate rahul gandhi victory pakistani flags fact check wayanad cheer rahul gandhi waving pakistan flags
11664,29837,"DMK leader MK Stalin elevated to party president, secretary Durai Murugan becomes treasurer",https://static.theprint.in/wp-content/uploads/2018/08/2018_8img27_Aug_2018_PTI8_27_2018_000243B-324x235.jpg,THEPRINT,ELECTION,Aug-18,TRUE,"['dmk', 'leader', 'stalin', 'elevated', 'party', 'president', 'secretary', 'durai', 'murugan', 'treasurer']",dmk leader stalin elevated party president secretary durai murugan treasurer
45619,23150,"4 arrested for Rs 400 Crore GST fraud, ED likely to investigate",https://www.thestatesman.com/wp-content/uploads/2019/09/fa1645a09744ef2415cc5b9a57e1476d.jpg,THESTATESMAN,VIOLENCE,Sep-19,TRUE,"['arrested', 'crore', 'gst', 'fraud', 'likely', 'investigate']",arrested crore gst fraud likely investigate
27374,25315,Beirut's cultural community was already at breaking point. Then the blast hit,https://cdn.cnn.com/cnnnext/dam/assets/200812111641-09-beirut-explosion-culture-sursock-palace-super-tease.jpg,CNN,POLITICS,Aug-20,TRUE,"['beirut', 'cultural', 'community', 'breaking', 'point', 'blast', 'hit']",beirut cultural community breaking point blast hit
35323,39841,Old photos of unrelated aircrafts are used to claim Rafale fighter jet crashed during training in India in September 2020,https://factcheck.afp.com/sites/default/files/styles/landing_tag_item_l/public/medias/factchecking/factcheck-visual_8_6.png?itok=51NNduOA,AFP,VIOLENCE,20-Sep,Fake,"['old', 'photos', 'unrelated', 'aircrafts', 'claim', 'rafale', 'fighter', 'jet', 'crashed', 'training', 'india', 'september']",old photos unrelated aircrafts claim rafale fighter jet crashed training india september
54707,24118,Chhattisgarh  MLA accused of ÔmisbehavingÕ with Air India female staff,https://www.thestatesman.com/wp-content/uploads/2019/06/AI.jpg,THESTATESMAN,VIOLENCE,Jun-19,TRUE,"['chhattisgarh', 'mla', 'accused', 'ômisbehavingõ', 'air', 'india', 'female', 'staff']",chhattisgarh mla accused ômisbehavingõ air india female staff
7561,10409,Inmate asked to dump garbage outside Goa prison; escapes,https://cmsimages.tribuneindia.com/gallary_content/2020/8/2020_8$smallthumbimg_483990038.jpg,TRIBUNEINDIA,VIOLENCE,Aug-20,TRUE,"['inmate', 'asked', 'dump', 'garbage', 'outside', 'goa', 'prison', 'escapes']",inmate asked dump garbage outside goa prison escapes
10234,3502,"PM Modi to lay foundation stone of new Parliament building: Total cost, dates and everything we know so far","https://images.indianexpress.com/2020/11/new-parliament-complex-1200-outside.jpg?resize=450,253",INDIANEXPRESS,POLITICS,Nov-20,TRUE,"['modi', 'lay', 'foundation', 'stone', 'new', 'parliament', 'building', 'total', 'cost', 'dates', 'know', 'far']",modi lay foundation stone new parliament building total cost dates know far
6476,3592,"Will back you to the hilt, Mamata Banerjee assures protesting farmers","https://images.indianexpress.com/2020/12/tmc.jpg?resize=450,250",INDIANEXPRESS,GOVERNMENT,Dec-20,TRUE,"['hilt', 'mamata', 'banerjee', 'assures', 'protesting', 'farmers']",hilt mamata banerjee assures protesting farmers
46407,49466,Fact Check: Is Central Govt Distributing Rs 2000 To Every Girl Child Under PM Kalyan Aashirvad....Fact Check: Ambanis to help Kangana with Rs 200 crore for new studio?, https://newsmobile.in/wp-content/uploads/2020/11/WhatsApp-Image-2020-11-27-at-3.08.33-PM.jpeg,AUGMENT,COVID-19,,Fake,"['fact', 'check', 'central', 'govt', 'distributing', 'girl', 'child', 'kalyan', 'aashirvad', 'fact', 'check', 'ambanis', 'help', 'kangana', 'crore', 'new', 'studio']",fact check central govt distributing girl child kalyan aashirvad fact check ambanis help kangana crore new studio
33377,772,Moga villages pass resolutions: Û÷Covid patients will be treated in village itselfÛª,"https://images.indianexpress.com/2020/09/punjab-police.jpg?resize=450,250",INDIANEXPRESS,COVID-19,Sep-20,TRUE,"['moga', 'villages', 'pass', 'resolutions', 'covid', 'patients', 'treated', 'village']",moga villages pass resolutions covid patients treated village
30720,47058,Fact Checked: Kolkata doctor assaulted by patientÕs kin is NOT dead, https://www.thestatesman.com/wp-content/uploads/2020/02/doctor.jpg,AUGMENT,MISLEADING,,Fake,"['fact', 'checked', 'kolkata', 'doctor', 'assaulted', 'patientõs', 'kin', 'dead']",fact checked kolkata doctor assaulted patientõs kin dead
37521,19401,Delhi airport opens exclusive terminal for private jets,https://cmsimages.tribuneindia.com/gallary_content/2020/9/2020_9$smallthumbimg_1372661664.jpg,TRIBUNEINDIA,TERROR,Sep-20,TRUE,"['delhi', 'airport', 'opens', 'exclusive', 'terminal', 'private', 'jets']",delhi airport opens exclusive terminal private jets
49298,22108,ÔWomen like her give birth to rapistsÕ: Kangana Ranaut on Indira JaisingÕs Ôforgive Nirbhaya convictsÕ appeal,https://www.thestatesman.com/wp-content/uploads/2020/01/2-15.jpg,THESTATESMAN,VIOLENCE,Jan-20,TRUE,"['ôwomen', 'like', 'birth', 'rapistsõ', 'kangana', 'ranaut', 'indira', 'jaisingõs', 'ôforgive', 'nirbhaya', 'convictsõ', 'appeal']",ôwomen like birth rapistsõ kangana ranaut indira jaisingõs ôforgive nirbhaya convictsõ appeal
27048,27862,"Article 370 move breach of constitutional promise by Nehru and Patel to J&K, says Owaisi",https://static.theprint.in/wp-content/uploads/2019/08/Asaduddin-Owaisi-324x235.jpg,THEPRINT,ELECTION,Aug-19,TRUE,"['article', 'breach', 'constitutional', 'promise', 'nehru', 'patel', 'says', 'owaisi']",article breach constitutional promise nehru patel says owaisi
53150,13646,CISF jawan succumbs to COVID-19; 18th death among paramilitary forces,https://cmsimages.tribuneindia.com/gallary_content/2020/6/2020_6$smallthumbimg_1961240473.JPG,TRIBUNEINDIA,COVID-19,Jun-20,TRUE,"['cisf', 'jawan', 'succumbs', 'covid', 'death', 'paramilitary', 'forces']",cisf jawan succumbs covid death paramilitary forces
26025,24317,"19-year-old girl gangraped by friends, dies in Aurangabad",https://www.thestatesman.com/wp-content/uploads/2019/05/Alwar-gang-2.jpg,THESTATESMAN,GOVERNMENT,May-19,TRUE,"['year', 'old', 'girl', 'gangraped', 'friends', 'dies', 'aurangabad']",year old girl gangraped friends dies aurangabad
11390,32345,"Left Front worker missing since youths, students Nabanna March",https://www.thestatesman.com/wp-content/uploads/2021/02/FB_IMG_1613294855831.jpg,THESTATEMAN,GOVERNMENT,Feb-21,TRUE,"['left', 'worker', 'missing', 'youths', 'students', 'nabanna', 'march']",left worker missing youths students nabanna march
41434,4096,"Collective, volunteers: In Kerala local polls, no politics is new politics","https://images.indianexpress.com/2020/11/Kerala-7.jpg?resize=450,250",INDIANEXPRESS,ELECTION,Nov-20,TRUE,"['collective', 'volunteers', 'kerala', 'local', 'polls', 'politics', 'new', 'politics']",collective volunteers kerala local polls politics new politics
45091,44066,Fact Check: Did this woman knock off a priest for saying fat women wont go to heaven?,https://akm-img-a-in.tosshub.com/indiatoday/images/story/201909/fat_woman_cover_pic-170x96.png?uNE3XBMBPuSoSJENblWx_xu1gCUJcmF4,INDIATODAY,POLITICS,19-Sep,Fake,"['fact', 'check', 'woman', 'knock', 'priest', 'saying', 'fat', 'women', 'heaven']",fact check woman knock priest saying fat women heaven
40222,27939,"How to tame swollen Ghaggar? Flood fear looms but consensus eludes Punjab, Haryana",https://static.theprint.in/wp-content/uploads/2019/07/Ghaggar_river_in_Panchkula-324x235.jpg,THEPRINT,GOVERNMENT,Jul-19,TRUE,"['tame', 'swollen', 'ghaggar', 'flood', 'fear', 'looms', 'consensus', 'eludes', 'punjab', 'haryana']",tame swollen ghaggar flood fear looms consensus eludes punjab haryana
48344,53903,"TOI Editor Tweets Misleading WhatsApp Message Targeting Amartya Sen,...",https://englishtribuneimages.blob.core.windows.net/gallary-content/2020/12/2020_12$smallthumbimg_320337164.jpg,AUGMENT,POLITICS,,Fake,"['toi', 'editor', 'tweets', 'misleading', 'whatsapp', 'message', 'targeting', 'amartya', 'sen']",toi editor tweets misleading whatsapp message targeting amartya sen
19585,15610,183 stranded Indians brought back from Muscat,https://cmsimages.tribuneindia.com/gallary_content/2020/5/2020_5$smallthumbimg_953524044.JPG,TRIBUNEINDIA,COVID-19,May-20,TRUE,"['stranded', 'indians', 'brought', 'muscat']",stranded indians brought muscat
1424,23439,"Tis Hazari clash: Security tightened as lawyers go on strike, top cop removed",https://www.thestatesman.com/wp-content/uploads/2019/11/police-1.jpg,THESTATESMAN,GOVERNMENT,Nov-19,TRUE,"['tis', 'hazari', 'clash', 'security', 'tightened', 'lawyers', 'strike', 'cop', 'removed']",tis hazari clash security tightened lawyers strike cop removed
26950,23374,Latest map ÔaccurateÕ: India on NepalÕs objection over Kalapani area,https://www.thestatesman.com/wp-content/uploads/2019/11/India-Nepal.jpg,THESTATESMAN,POLITICS,Nov-19,TRUE,"['latest', 'map', 'ôaccurateõ', 'india', 'nepalõs', 'objection', 'kalapani', 'area']",latest map ôaccurateõ india nepalõs objection kalapani area
46501,29055,"Congress kept out of UP alliance to correct poll arithmetic, says Akhilesh Yadav",https://static.theprint.in/wp-content/uploads/2018/12/2018_12img30_Dec_2018_PTI12_30_2018_000083B-e1546168035527-324x235.jpg,THEPRINT,ELECTION,Dec-18,TRUE,"['congress', 'kept', 'alliance', 'correct', 'poll', 'arithmetic', 'says', 'akhilesh', 'yadav']",congress kept alliance correct poll arithmetic says akhilesh yadav
56457,10026,UP: 2 more cops suspended over Dalit boyÛªs Û÷custodialÛª death,https://cmsimages.tribuneindia.com/gallary_content/2020/9/2020_9$smallthumbimg_2057977822.jpg,TRIBUNEINDIA,VIOLENCE,Sep-20,TRUE,"['cops', 'suspended', 'dalit', 'boy', 'ûªs', 'custodial', 'death']",cops suspended dalit boy ûªs custodial death
24277,50510,"No, this is not the nephew of UP Deputy CM Keshav Maurya assaulting a Sikh driver",https://static.theprint.in/wp-content/uploads/2017/11/IMG_5624-e1563893466354-324x235.jpg,AUGMENT,VIOLENCE,,Fake,"['nephew', 'deputy', 'keshav', 'maurya', 'assaulting', 'sikh', 'driver']",nephew deputy keshav maurya assaulting sikh driver
6297,3015,Three terrorists killed in an encounter with security forces in Sugan area of Shopian in J&K,"https://imgk.timesnownews.com/story/encounter_JK_ANI_3.jpeg?tr=w-100,h-75",TIMESNOW,COVID-19,Oct-20,TRUE,"['terrorists', 'killed', 'encounter', 'security', 'forces', 'sugan', 'area', 'shopian']",terrorists killed encounter security forces sugan area shopian
55025,39113,The True Story Behind One Of India's Most Well Known Fakes,https://boomlive.in/wp-content/uploads/2019/05/modi-nauka03.jpg,BOOMLIVE,GOVERNMENT,19-May,Fake,"['true', 'story', 'india', 'known', 'fakes']",true story india known fakes
18931,38989,Viral Message Claiming 10-Year Jail Term For Attack On Christians Is...,https://boomlive.in/wp-content/uploads/2018/10/Supreme-court-messag.jpg,BOOMLIVE,MISLEADING,18-Oct,Fake,"['viral', 'message', 'claiming', 'year', 'jail', 'term', 'attack', 'christians']",viral message claiming year jail term attack christians
20583,46922,Old Image From Egypt Goes Viral In India As Beef Ban Debate Rages, https://www.thestatesman.com/wp-content/uploads/2020/12/QT-Uddhav-Thackeray.jpg,AUGMENT,MISLEADING,,Fake,"['old', 'image', 'egypt', 'goes', 'viral', 'india', 'beef', 'ban', 'debate', 'rages']",old image egypt goes viral india beef ban debate rages
35757,39768,Dr Aishaâs claim on Twitter as a Covid-19 victim sends many into mourning; Fact Check,https://digiteye.in/wp-content/uploads/2020/08/aisha-fake-stamp-300x160.jpg,DIGITEYE,MISLEADING,20-Aug,Fake,"['aishaâ', 'claim', 'twitter', 'covid', 'victim', 'sends', 'mourning', 'fact', 'check']",aishaâ claim twitter covid victim sends mourning fact check
39825,2476,"No earthquake in Hampi, was false alarm by software: Karnataka Natural Disaster Monitoring Centre",https://www.thestatesman.com/wp-content/uploads/2020/06/hampi.jpg,THESTATESMAN,TERROR,Jun-20,TRUE,"['earthquake', 'hampi', 'false', 'alarm', 'software', 'karnataka', 'natural', 'disaster', 'monitoring', 'centre']",earthquake hampi false alarm software karnataka natural disaster monitoring centre
41938,7370,Himachal to create 100 parks providing recreational space to elderly,https://www.thestatesman.com/wp-content/uploads/2020/07/park.jpg,THESTATEMAN,GOVERNMENT,Jul-20,TRUE,"['himachal', 'create', 'parks', 'providing', 'recreational', 'space', 'elderly']",himachal create parks providing recreational space elderly
55727,55591,Did Uddhav Thackeray bow in front of Sonia Gandhi?s picture? Here?s....Fact Check: Did Rahul Gandhi stage his meeting with migrants at Delhis Sukhdev Vihar?,https://www.thestatesman.com/wp-content/uploads/2020/04/train-3.jpg,AUGMENT,MISLEADING,,Fake,"['uddhav', 'thackeray', 'bow', 'sonia', 'gandhi', 'picture', 'fact', 'check', 'rahul', 'gandhi', 'stage', 'meeting', 'migrants', 'delhi', 'sukhdev', 'vihar']",uddhav thackeray bow sonia gandhi picture fact check rahul gandhi stage meeting migrants delhi sukhdev vihar
30926,11912,"Delay in calling session will create a constitutional crisis, former law ministers tell Rajasthan governor",https://cmsimages.tribuneindia.com/gallary_content/2020/7/2020_7$smallthumbimg_1163676457.jpg,TRIBUNEINDIA,ELECTION,Jul-20,TRUE,"['delay', 'calling', 'session', 'create', 'constitutional', 'crisis', 'law', 'ministers', 'tell', 'rajasthan', 'governor']",delay calling session create constitutional crisis law ministers tell rajasthan governor
4887,22593,"Indian-Americans protest against CAA, NRC in front of Mahatma Gandhi statue in Washington",https://www.thestatesman.com/wp-content/uploads/2019/12/us-1.jpg,THESTATESMAN,POLITICS,Dec-19,TRUE,"['indian', 'americans', 'protest', 'caa', 'nrc', 'mahatma', 'gandhi', 'statue', 'washington']",indian americans protest caa nrc mahatma gandhi statue washington
39961,37081,"Donald Trumpï¿½s threat to Iran, and what it means for the world and India",https://static.theprint.in/wp-content/uploads/2018/04/trump-2-e1570773280874-324x235.jpg,THEPRINT,TRAD,Apr-18,TRUE,"['donald', 'trumpï', 'threat', 'iran', 'means', 'world', 'india']",donald trumpï threat iran means world india
48354,18968,"SOPs for cultural events: Artistes, crew need Covid-negative certificate, no entry without masks",https://cmsimages.tribuneindia.com/gallary_content/2020/10/2020_10$smallthumbimg_1724772263.JPG,TRIBUNEINDIA,COVID-19,Oct-20,TRUE,"['sops', 'cultural', 'events', 'artistes', 'crew', 'need', 'covid', 'negative', 'certificate', 'entry', 'masks']",sops cultural events artistes crew need covid negative certificate entry masks
21776,33890,BMC withdraws its no burial order for dead bodies of COVID-19 patients,https://www.thestatesman.com/wp-content/uploads/2020/03/burial.jpg,THESTATEMAN,VIOLENCE,Mar-20,TRUE,"['bmc', 'withdraws', 'burial', 'order', 'dead', 'bodies', 'covid', 'patients']",bmc withdraws burial order dead bodies covid patients
18646,33462,"UN welcomes Indias COVID-19 stimulus package, slashes growth to 1.2%",https://www.thestatesman.com/wp-content/uploads/2020/05/construction-1.jpg,THESTATEMAN,COVID-19,May-20,TRUE,"['welcomes', 'india', 'covid', 'stimulus', 'package', 'slashes', 'growth']",welcomes india covid stimulus package slashes growth
